### ISSUE TITLE
tcp 协议小结

### ISSUE THREAD

**Issue by buf1024** [buf1024/mydoc#1]
&emsp;&emsp;tcp协议是一个比较复杂的协议，对tcp协议深入理解的，真的非常少非常少；对tcp协议误理解或理解片面的，真的非常多非常多。当然这也包括自己在内，当然也可能包括这篇小结在内。
&emsp;&emsp;P.S.: 《TCP/IP详解卷1:协议》是介绍TCP/IP协议栈最经典的著作(神级已故人物[W.Richard Stevens](http://baike.baidu.com/link?url=5f_wcdexs92JUD0PxwyKhGPSi6a1sOHhrKWHUewqy5-0RQJtyAfHtCDLJ5L7gOaXr6efGrfxv3FR9C2Xkb5jda)经典书籍之一)，然而个人觉得这个“详解”对于tcp的介绍有点简略或者理解起来印象非深，读了一次，一次又一次，还是概念模糊。当然这也与中文译本烂得一塌糊涂有关。同时这本经典书籍也有了它的更新版，不同的是作者已经不是原来的神级人物，相同的是译文继续烂。

## tcp协议头
![tcp协议头](http://luoguochun.cn/img/tcp/tcp-header2.png)
&emsp;&emsp;tcp基本协议头占用20个字节，协议中`Header Length(4bits)`中标明协议头的长度，含义是多少个32bit数据，该字段占用4位，所有整个tcp头最多可以占用60字节。当tcp建立时，主机会生成一个初始的序列号(ISN, Initial Sequence Number)，在tcpdump程序抓取的报文中可以看到该初始Sequence，Sequence的生成方式有一定的算法，一般tcp分析很少关注。如果tcpdump查看报文，可以发现，第一个`SYN`包收到`ACK`后，后续的SEQ都变成了ISN的偏移量。如果是用大鲨鱼wireshark查看报文，则可以发现，seq总是从0开始，并提示这个值是相对值，大鲨鱼已经处理好这些细节。如：
![tcpdump seq](/img/tcp/tcp-tcpdump-isn.png)
![wireshark seq](/img/tcp/tcp-wireshark-isn.png)

 &emsp;&emsp;tcp报文`SYN ACK`的计算如下：

         A -> B SYN J ACK K LEN L
         B -> A SYN K ACK J+L LEN M
         A -> B SYN J+L ACK K+M
         
         

&emsp;&emsp;需要注意到的是，注意，对于`DATA LEN`为0的，发送的`SYN`包和`FIN`包，需要消耗一个序号。为了提高传送的效率，`ACK`是支持累计的，也就是说没必要对每个`SYN`进行`ACK`。如：发送端连续发送3个报文，那么接收端收到3个报文后，可以直接应答一个`ACK`。

### tcp标志位

1. **CWR**(Congestion Window Reduced) & **ECN**（ECN-Echo, Explicit Congestion Notification）
 **CWR** 阻塞窗口已减少，意思是告诉对端我已经按照你的要求，进行阻塞窗口减少了，并启动阻塞算法来控制我的发包速度； **ECN** 显式阻塞窗口通知，意思通知发送方，我接收的报文出现了阻塞，请控制发包速度。也就是说，**CWR** 和 **ECN** 必须配合使用，**CWR** 是收到 **ECN** 的应答。此外，在tcp三次握手时，这两个标志表明tcp端是否支持**ECN**。如果建立连接一方支持，则在发送的`SYN`包，将 **ECN** 标志置为1，如果服务端也支持，则在`ACK`包只设置**ECN**。缘由：tcp建立连接后，报文经过经过路由或网关等网络设备后，在路由器或网关等网络设备出现阻塞时，路由器或网关等设备设置**IP**层的某个标志表明出现阻塞，这样接收可以明确知道报文出现了阻塞。然而，需要知道阻塞进行阻塞控制的是报文发送方而非接收方。所以接收方会在`ACK`报文中设置**ECN**标志，同时发送方在`ACK`中设置**CWR**标志，表明已经收到**ECN**，并进行了减少阻塞窗口操作和启用阻塞算法。 

2. **URG**(Urgent)
 这就是传说中的带外数据。因为tcp是没有消息边界的，假如有一种情况，你已经发送了一些数据，但是此时，你要发送一些数据优先处理，就可以设置这些标志。同时如果设置了这个标志，紧急指针(报文头中, `Urgent Pointer(16Bit)`部分)也会设置为相应的偏移。当接受方收到**URG**数据时，不缓存在接收窗口，直接往上传给上层。具体的使用带外数据大体的方法，就是，调用`send`和`recv`是要加上`MSG_OOB`参数。同时接收方要处理`SIGURG`信号。使用`MSG_OOB`是需要注意：
 1) 紧急指针只能标示一个字节数据，所以如果发送带外数据多于一个字节，其他数据将当成是正常的数据。
 2) 接收端需要调用`fcntl(sockfd,F_SETOWN, getpid());`，对socket描述符号进行宿主设置，否则无法捕获`SIGURG`信号。
 3) 如果设置选项`SO_OOBINLINE`，那么将不能使用`MSG_OOB`参数接收的报文(调用报错)，紧急指针的字符将被正常读出来，如果需要判断是否紧急数据，则需要提前判断：`ioctl (fd,SIOCATMARK,&flag);if (flag) {read(sockfd,&ch,1);`。
 不过，据说这个带外数据在实际上，用得很少。

3. **PSH**（Push）
 tcp报文的流动，先是发送方塞进发送方的缓存再发送；同样接收方是先塞到接收方的缓存再投递到应用。**PSH**标志的意思是，无论接收或发送方，都不用缓存报文，直接接收投递给上层应用或直接发送。**PSH**标志可以提供报文发送的实时性。如果设置了`SO_NODELAY`选项(也就是关闭`Nagle`算法)，可以强制设置这个标志。

4. **SYN**(Synchronize), **ACK**(Acknowledgement), **FIN**（Finish）和 **RST**(Reset)
 这几个标记比较容易理解。**SYN**, Synchronize sequence numbers。**ACK**, `Acknowledgement Number`有效，应答标记。**FIN**,发送端结束发送。**RST**连接不可达。
   
   
### tcp 选项(不完全)
&emsp;&emsp;tcp 除了20字节基本数据外，后面还包括了最多40个字节的tcp的选项。tcp选项一般存储为`kind/type(1byte) length(1byte) value`的格式式，不同的选项具体格式有所不同。这里简单罗列一些常见的tcp选项并做简单介绍。

1. **MSS**(Maximum Segment Size)
 tcp报文最大传输长读，tcp在三次握手建立阶段，在`SYN`报文交互该值，注意的是，这个数值并非协商出来的，而是由网络设备属性得出。**MSS**一个常见的值是1460(**MTU**1500 - **IP**头部 - **TCP**头部)。 

2. **SACK**(Selective Acknowledgements)
 选择ACK，用于处理segment不连续的情况，这样可以减少报文重传。比如： A 向B发送4个segment，B收到了1,2,4个segment，网络丢失了3这个segment。B收到1,2segment后，回应`ACK` 3，表示1,2这两个`ACK`已经收到，同时在选项字段里面，包括4这个段，表示4这个segment也收到了。于是A就重传3这个segment，不必重传4这个segment。B收到3这个segment后，直接`ACK` 5，表明3,4都收到了。
 
3. **WS**(Window Scale)
 在tcp头部，`Window Size(16Bit)`表面接收窗口大小，但是对于现代网络而言，这个值太小了。所以tcp通过选项来增加这个窗口的值。**WS**值的范围0～14，表示`Window Size(16Bit)`数值先向左移动的位数。这样实际上窗口的大小可达31位。在程序网络设计时，有个`SO_RECVBUF`，表示设置接收缓冲的大小，然而需要注意的是，这个值和接收窗口的大小不完全相等，但是这个数值和接收窗口存在一定的关系，在内核配置的范围内，大小比较接近。
 
4. **TS**(Timestamps)
 Timestamps在tcp选项中包括两个32位的timestamp: **TSval**(Timestamp value)和**TSecr**(Timestamp Echo Reply)。如果设置了**TS**这个选项，发送方发送时，将当前时间填入**TSval**，接收方回应时，将发送方的**TSval**填入**TSecr**即可(注意发送或接收都有设置**TSval**和**TSecr** )。**TS** 选项的存在有两个重要作用：一是可以更加精确计算RTT(Round-Trip-Time)，只需要在回应报文里面用当前时间减去**TSecr**即可；二是PAWS(Protection Against Wrapped Sequence number, 防止sequence回绕)，什么意思呢？比如说，发送大量的数据：0-10G，假设segment比较大为1G而且sequence比较小为5G，接收端接收1,3,4,5数据段正常接收，收到的发送时间分别1,3,4,5，第2 segment丢失了，由于**SACK**，导致2被重传，在接收6时，sequence由于回绕变成了1，这时收到的发送时间为6，然后又收到迷途的2，seq为2，发送时间为2，这个时间比6小，是不合法的，tcp直接丢弃这个迷途的报文。
 
5. **UTO**(User Timeout)
 **UTO**指的是发送`SYN`，收到`ACK`的超时时间，如果在**UTO**内没有收到，则认为对端已挂。
 在网络程序设计的时候，为了探测对端是否存活，经常涉及心跳报文，通过tcp的keepalive和**UTO**机制也可以实现，两者的区别是，前者可以通过心跳报文实时知道对端是否存活，二后者只有等待下次调用发送或接收函数才可以断定：
 1) `SO_KEEPALIVE`相关选项
  设置`SO_KEEPALIVE` 选项，打开keepalive机制。
  设置`TCP_KEEPIDLE` 选项，空闲时间间隔启动keepalive机制，默认为2小时。
  设置`TCP_KEEPINTVL`选项，keepalive机制启动后，每隔多长时间发送一个keepalive报文。默认为75秒。
  设置`TCP_KEEPCNT`选项，设置发送多少个keepalive数据包都没有正常响应，则断定对端已经崩溃。默认为9。
  由于tcp有超时重传机制，如果对于`ACK`丢失的情况，keepalive机制将有可能失效。
 
 2) `TCP_USER_TIMEOUT`相关选项
  `TCP_USER_TIMEOUT`选项的函义是多久没有收到`ACK`则认为对端已经挂了。
 
 配合`SO_KEEPALIVE`和`TCP_USER_TIMEOUT`选项，可以利用tcp机制实现探测对端存活。

 
## tcp 建立和终止
&emsp;&emsp;正常情况下，tcp的建立需要进行3次握手，tcp断开需要进行4次挥手。抓包看下建立连接和断开过程，通过抓取22端口报文，用telnent远程连接22端口测试，测试命令如下：

        heidong@HEIDONGVM:~$ sudo tcpdump -i eth0 port 22 -s 0 -w tcpdump-est-fin.cap
        
        heidong@HEIDONGVM:~$ telnet 192.168.1.101 22
        Trying 192.168.1.101...
        Connected to 192.168.1.101.
        Escape character is '^]'.
        SSH-2.0-OpenSSH_6.1
       ^]
       
        telnet> quit
        Connection closed.
        heidong@HEIDONGVM:~$

![wireshark tcp 报文](/img/tcp/tcp-tcpdump-est-fin.png)
1. TCP3次握手的过程是帧1到3 
- 第1帧，发送SYN J:
 
         36600→22 [SYN] Seq=0 Win=29200 Len=0 MSS=1460 SACK_PERM=1 TSval=1488865 TSecr=0 WS=128
    
    从主机10.0.2.15:36600 -> 192.168.1.101:22报文，`MSS=1460`， `Win=29200`，由于后面有`WS=128`选项，所以`Window=29200*128`。`SACK_PERM=1`表明10.0.2.15这台主机支持 **SACK**。`TSval`和`TSecr`为 **TS**的两个数值。
- 第2帧，发送SYN K， ACK J+1:
 
        22→36600 [SYN, ACK] Seq=0 Ack=1 Win=65535 Len=0 MSS=1460
    
    从主机192.168.1.101:22 -> 10.0.2.15:36600报文，`SYN`报文将消耗一个字节，所以这里`ACK`为1。192.168.1.101这太主机的`MSS=1460`, `win=65535`没有**WS**。
- 第3帧，发送ACK K+1:
 
        36600→22 [ACK] Seq=1 Ack=1 Win=29200 Len=0 
  
    这是建立TCP连接的第3次握手，是主机10.0.2.15对第二帧的应答，这时`win=29200`，意思是，接收窗口的大小。

 当这3次交互完成后，连接真正建立，就可以接收和发送数据了。

2. TCP终止连接的4次挥手过程是帧6到9
- 第6帧，发送FIN J, ACK K:
 
        36600→22 [FIN, ACK] Seq=1 Ack=22 Win=29200 Len=0
        
   主机10.0.2.15：36600主动关闭连接，发送`FIN`，和上个报文的`ACK`，这是第一次交换。
- 第7帧，发送ACK J+1:
 
         22→36600 [ACK] Seq=22 Ack=2 Win=65535 Len=0
         
   主机192.168.1.101:22，回应第6帧`FIN`。
- 第8帧，FIN K, ACK J+1:
 
         22→36600 [FIN, ACK] Seq=22 Ack=2 Win=65535 Len=0
         
   主机192.168.1.101:22关闭socket，发送`FIN`。
- 第9帧，ACK K+1:
 
         36600→22 [ACK] Seq=2 Ack=23 Win=29200 Len=0
   
   主机10.0.2.15:36600，回应第5帧`FIN`。
   
   至此，tcp进行了正常的关闭，10.0.2.15：36600进入了`TIME_WAIT`状态。此次交互是非常理想的4次挥手过程，现实中，4次挥手的每一次交互的过程中都有可能携带额外的数据。
   另外，tcp在结束连接时，例如它断开发送能力时，却依然希望能够接收数据。这属于tcp的半关闭功能。在程序实现时，不是调用`close`函数，而是调用`shutdown`函数，`shutdown`函数有个参数指明怎么关闭连接。
   
### 异常情况
1. 建立连接异常
 1.1 建立连接端口不存在
  如果对端的端口不存在，那么在报文中回应`RST`标志，表示连接不可达。事实上发送端在需要重复一次`SYN`报文，对端才会响应`RST`。如:
  
        heidong@HEIDONGVM:~$ telnet 192.168.1.101 9900
        Trying 192.168.1.101...
        telnet: Unable to connect to remote host: Connection refused
        heidong@HEIDONGVM:~$ 
  
        heidong@HEIDONGVM:~$ sudo tcpdump -i eth0 host 192.168.1.101
        [sudo] password for heidong: 
        tcpdump: verbose output suppressed, use -v or -vv for full protocol decode
        listening on eth0, link-type EN10MB (Ethernet), capture size 65535 bytes
        21:19:36.424426 IP 10.0.2.15.52519 > 192.168.1.101.9900: Flags [S], seq 4012293140, win 29200, options [mss 1460,sackOK,TS val 5302548 ecr 0,nop,wscale 7], length 0
        21:19:37.424498 IP 10.0.2.15.52519 > 192.168.1.101.9900: Flags [S], seq 4012293140, win 29200, options [mss 1460,sackOK,TS val 5302798 ecr 0,nop,wscale 7], length 0
        21:19:37.516340 IP 192.168.1.101.9900 > 10.0.2.15.52519: Flags [R.], seq 0, ack 4012293141, win 0, length 0
        ^C
        3 packets captured
        3 packets received by filter
        0 packets dropped by kernel
        heidong@HEIDONGVM:~$ 
  
 1.2 建立连接主机不存在
  如果连接的主机不存在，那么tcp 会重发报文`SYN`。重发的次数在内核参数了`net.ipv4.tcp_syn_retries`配置，如:
   
        heidong@HEIDONGVM:~$ cat /proc/sys/net/ipv4/tcp_syn_retries 
        6
 
  重连重试的是时间分别是。2^X-1秒。如:
   
        heidong@HEIDONGVM:~$ telnet 192.168.1.101 9900
        Trying 192.168.1.101...
        telnet: Unable to connect to remote host: Connection refused
        heidong@HEIDONGVM:~$ telnet 192.168.1.156 9900
        Trying 192.168.1.156...
        telnet: Unable to connect to remote host: Connection timed out
        heidong@HEIDONGVM:~$
  
        heidong@HEIDONGVM:~$ sudo tcpdump -i eth0 host 192.168.1.156
        tcpdump: verbose output suppressed, use -v or -vv for full protocol decode
        listening on eth0, link-type EN10MB (Ethernet), capture size 65535 bytes
        21:39:58.109141 IP 10.0.2.15.38610 > 192.168.1.156.9900: Flags [S], seq 1424720904, win 29200, options [mss 1460,sackOK,TS val 5607969 ecr 0,nop,wscale 7], length 0
        21:39:59.109694 IP 10.0.2.15.38610 > 192.168.1.156.9900: Flags [S], seq 1424720904, win 29200, options [mss 1460,sackOK,TS val 5608219 ecr 0,nop,wscale 7], length 0
        21:40:01.112512 IP 10.0.2.15.38610 > 192.168.1.156.9900: Flags [S], seq 1424720904, win 29200, options [mss 1460,sackOK,TS val 5608720 ecr 0,nop,wscale 7], length 0
        21:40:05.119962 IP 10.0.2.15.38610 > 192.168.1.156.9900: Flags [S], seq 1424720904, win 29200, options [mss 1460,sackOK,TS val 5609722 ecr 0,nop,wscale 7], length 0
        21:40:13.146103 IP 10.0.2.15.38610 > 192.168.1.156.9900: Flags [S], seq 1424720904, win 29200, options [mss 1460,sackOK,TS val 5611728 ecr 0,nop,wscale 7], length 0
        21:40:29.176601 IP 10.0.2.15.38610 > 192.168.1.156.9900: Flags [S], seq 1424720904, win 29200, options [mss 1460,sackOK,TS val 5615736 ecr 0,nop,wscale 7], length 0
        21:41:01.208154 IP 10.0.2.15.38610 > 192.168.1.156.9900: Flags [S], seq 1424720904, win 29200, options [mss 1460,sackOK,TS val 5623744 ecr 0,nop,wscale 7], length 0
        ^C
        7 packets captured
        7 packets received by filter
        0 packets dropped by kernel
        heidong@HEIDONGVM:~$ 

2. 断开连接异常 
 对于没有正常收到`FIN`异常终止连接的情况，tcp回应`RST`。
 另外，`SO_LINGER`选项提供异常终止的能力：
 默认的情况下，使用`close`函数关闭一个连接，tcp默认的行为是，1) 如果发送缓冲没有数据，发送`FIN`并直接返回 2) 如果缓冲存在数据，tcp将尽力把数据发送出去，然后发送`FIN`并返回。`SO_LINGER`选项可以改变这默认行为，相关数据结构
        
        struct linger {
            int l_onoff; /* 0=off, nozero=on */
            int l_linger; /* linger time, POSIX specifies units as seconds*/
        }
 1) `l_onoff` = 0，`l_linger`被忽略，同默认行为
 2) `l_onoff` 非0，`l_linger`为0，`close`清空发送缓冲，并发送`RST`，然后返回，这中情况下，可以避免`TIME_WAIT`状态的产生。
 3) `l_onoff`非0，`l_linger`大于0，`close`将使内核推延一段时间。如果缓冲有数据，进程将进入睡眠状态，直到数据发送完毕并收到对方的`ACK`或者滞留超时(`close`返回`EWOULDBLOCK`)，缓冲去数据丢失。(如果是非阻塞，则直接返回`EWOULDBLOCK`)
 `shutdown`使用可以避免关闭时还有数据的处理。
 
## tcp状态机
&emsp;&emsp;tcp在每个时刻都存在于一个特定的状态(**CLOSED**状态为假想状态)，这里的状态和`netstat`显示的状态是一致的，各个状态以及状态转换如下：
![TCP状态机](/img/tcp/tcp-state.png)
&emsp;&emsp;**TIME_WAIT**也称为**2MSL**(Maximum Segment Lifetime)状态，它可以保证对端发送最后的`FIN`(重发的)，能够响应`ACK`，另外一个含是，保证端口在**2MSL**端口不被重发使用。在服务端编程的时候，我们通常会使用`SO_REUSEADDR`这个选项，这样可以避免如果服务端进入**TIME_WAIT**状态后，可以及时重启。
&emsp;&emsp;**FIN_WAIT_2**状态是在发送`FIN`，接收到`ACK`时，进入的状态，如果对端没有发送`FIN`那么，将无法进入**TIME_WAIT**状态，这时对端一直是**CLOSE_WAIT**状态，当服务器出现大量的**FIN_WAIT_2** 或 **CLOSE_WAIT**状态时，一般都是被动关闭那端忘记了调用`close`函数关闭socket。

## TCP数据传输

1. 滑动窗口
 在tcp头部，窗口大小占用16位，再加上**WS**选项，实际上可以达31位。已经建立连接的**TCP**双方，都维护两个窗口，分别为接收窗口和接收窗口。
 
 1.1 发送方窗口
  ![发送方窗口](/img/tcp/tcp-sliding-window-snd.png)
  如图示，在任意一时刻，发送方的发送窗口数据可分4大类：1) 已经发送并收到`ACK`的，2) 已经发送并未收到`ACK`的，3) 准备发送的，4) 未发送的。第1和第2类数据之间的边界称为**左边界**；第3和第4类之间的数据称之为**右边界**。第2和第3类数据之间的窗口称之为`Offered Window`，是接收方通告的窗口大小。**左边界**向做右移动，称为窗口合拢；**右边界**向右移动，称为窗口张开；**右边界**向左移动，称为窗口的收缩(实际tcp实现不一定有)。如果**左边界**到达**右边界**，那么窗口为0，不能发送任何数据。当窗口变为0时，这里存在一个问题：因为接收方的窗口大小是通过`ACK`告知的，如果窗口为0了，那么哪里来的`ACK`呢？解决的办法是，发送方会发送`ZWP(Zero Windonw Probe)`的报文给接收端，让接收端应答`ACK`告知窗口大小，当发送方发送3次`ZWP`后(一般设置3次，每次给30~60秒)，如果窗口依然是0，那么有些tcp实现将关闭连接。在当发送方收到发送数据的`ACK`时，**左边界**向右合拢或窗口向右移动。注意到，只有收到`ACK`时，**左边界**才会右移。

 1.2 接收方窗口
  ![接收方窗口](/img/tcp/tcp-sliding-window-rcv.png)
  如图示，类似发送方窗口，接收方窗口分为3大类，1) 已经接收并发送`ACK`的，2) 将接收存储的，3) 不能接收的。第1和2类之间的边界称为**左边界**，第2和第3类数据之间的边界称之为**右边界**。当接收方收到报文的**SEQ**小与**左边界**，则当做是重发报文直接丢弃；当接收的报文的**SEQ**大于**右边界**，则认为是溢出也直接丢弃，只有报文在**左边界**和**右边界** 之间的报文才允许接收。如果在**左边界**和**右边界** 之间收到的非连续的报文(由于**SACK**，报文将缓存)，那么**左边界**并不会向右移动，等待重传数据连续后，才移动。
  
 由于滑动窗口的这些特性，接收方可以进行窗口的控制，通过告知对方窗口大大小，让发送方进行控制调整，从而具备流量控制功能。
 
2. 糊涂窗口综合症(`SWS`)
 如果建立连接的双方，当发送方产生的数据速度很慢，或者接收发消耗的数据很慢或者两者都有，这样会导致发送方向接收方发送极少量的数据，接收方回应很小的窗口。这样就会导致网络上存在大量的小数据包，tcp头部至少占20字节，加上**IP**头部的20字节，这个传输一个小包，耗费这么大的网络资源，这样是很不经济的，出现的这种情况称之为糊涂窗口综合症`Silly Window Syndrome(SWS)`，`SWS`导致网络利用的低效率。`SWS`可由发送方或接收方造成，解决方法：
 2.1 发送方**Nagle算法**
   **Nagle算法**最多允许有一个为确认的未完成小分组(小于**MSS**)，在该分组的**ACK**到达之前，不能发送其他小分组。也就是说，如果对端`ACK`回应的很快的话，**Nagle算法**并不会合并多少数据包(也就是说并不会启用)，在“低速”网络环境里面才会出现更多的小分组合并发送。tcp协议默认是打开 **Nagle算法**的，发送报文条件是：
   1) 如果包长度达到**MSS**，则允许发送；
   2) 如果该包含有`FIN`，则允许发送；
   3) 所有发出去的小数据包（包长度小于**MSS**）均被确认，则允许发送； 
   4) 上述条件都未满足，但发生了超时（一般设置延迟`ACK`，一般为200ms），则立即发送。
   
   `TCP_NODELAY`选项可以关闭**Nagle算法**。关闭后，只要有数据就立刻进行发送。
   
 2.2 接收方**Cork算法**或延长`ACK`
   如果接收方处理比较慢，`ACK`的窗口很小，这样接收端就引起`SWS`。**Cork算法**就是只要有数据达到，就回应，但是回应的窗口大小为0，直到空闲窗口已经可以放入**MSS**的报文长度，或者窗口的空间一半已经变为可用，这时才回应真实的可用窗口。`TCP_CORK`选项可以启用这个算法。另外的一种机制是延迟确认，接收端收到报文时，并不立刻进行确认，等到有足够的窗口空间，才进行确认。延迟确认会引入另外一个问题，就是会导致tcp发送方进行报文重发，现在延迟确认的数据定义为500毫秒。`TCP_QUICKACK`选项可以关闭延迟`ACK`，然而这个选项并非是永久的，需要每次接收数据后，重新设置一次。
 
## TCP阻塞控制
&emsp;&emsp;在复杂和经常变化的网络环境中，当网络程序阻塞时，tcp不是一味的发送数据加塞网络，而是进行自我调整。传统的阻塞控制算法有4种：慢启动(Slow Start)，阻塞避免(Congestion Avoidance)，快速重传(Fast Retransmit)，快速恢复(Fast Recovery)。
1. 慢启动
 **慢启动**算法启动发生在建立tcp连接后，或者报文重传超时(Retransmit Timeout, RTO)后，也有可能是tcp空闲某段时间后。慢启动为**TCP**增加了一个阻塞窗口(Congestion Window, cwnd)，**cwnd**以**MSS** 为单位，发送时，取 **cwnd**和通告的窗口大小最小值为发送上限。慢启动算法:
 1) **cwnd**通常初始化为1个**MSS**(Linux 3.0或以上，设置为10**MSS**)
 2) 在没有出现丢包的情况下，每收到一个`ACK`，**cwnd** = **cwnd** * 2
 3) 当**cwnd**增长的一个阈值，(slow start threshold, ssthresh)，即**cwnd** >= **ssthresh**，tcp 进入避免阻塞算法
 
 当**RTO**时，ssthresh = **cwnd** / 2，**cwnd** = 1，重启慢启动算法。
 
 由上可知，当 `ACK` 很快时，慢启动算法的增长速率是很快的。如果存在延迟确认，那么增长速率并不快，所以在建立连接的慢启动算法启动期间，延迟确认是关闭的。
 
2. 阻塞避免
 当**cwnd** >= **ssthresh**时，就会启用避免阻塞算法，算法如下：
 1) 每收到一个非重复的`ACK`，**cwnd** = **cwnd** + 1/**cwnd**
 避免阻塞算法，避免了慢启动那种指数级别的快速增长，而变成了缓慢的线性增长，慢慢调整到网络最佳值。
 
3. 快速重传
 当收到一连串3个或以上的重复`ACK`时，则可以认为有报文段丢失了，这个时候，不需要得等**RTO**，直接重传丢失的报文。这就是快速重传算法。但启用快速重传算法后，tcp并不启用慢启动算法，因为接收端已经在高速接收数据了，tcp不想突然减速，而是启动另个一个算法，快速恢复。

4. 快速恢复
 当收到3个或以上重发`ACK`，快速恢复算法启动，算法如下：
 1) **ssthresh** = **cwnd** / 2
 2) 每次收到重复的`ACK`， **cwnd** = **cwnd** + 1
 3) 收到新数据`ACK`，**cwnd** = **ssthresh**
 
 由上，网络出现阻塞时，快速恢复算法将发送速率降低了。

## 小结
&emsp;&emsp;这里小结只是tcp的很小一部分，没有涉及到tcp的方方面面，也没有涉及到内核调优，编程技巧等方方面面。另外tcp目前还是发展中的协议，随着时间推移，有很多新的功能特性添加进来，这里也没有涉及到。对于tcp的熟悉，必须通过抓包实践才能进行一步了解，停留在读书计理论，永远无法理解。期待以后有更全面的认识！

&emsp;&emsp;tcpdump 使用参考： http://luoguochun.cn/2015/07/25/tcpdump-usage/
&emsp;&emsp;完。

&emsp;&emsp;POST AT： http://luoguochun.cn/2016/09/23/tcp-fuck/
